{
  "locale": "it",
  "chapterId": "chapter_2",
  "title": "Sadhana Pada",
  "subtitle": "significato letterale essenziale",
  "description": "Il Sādhana Pāda presenta il percorso pratico dello yoga. Esamina le cause della sofferenza e introduce le prime cinque membra dell'aṣṭāṅga yoga: yama, niyama, āsana, prāṇāyāma e pratyāhāra.",
  "sutras": [
    {
      "sutraId": "sutra_2_01",
      "pronunciation": "ta-paḥ svā-dhyā-ya ī-śva-ra pra-ni-dhā-nā-ni kri-yā yo-gaḥ",
      "initialPronunciation": "ta-paḥ",
      "wordMeanings": [
        {
          "term": "tapaḥ",
          "meaning": "disciplina, ascesi"
        },
        {
          "term": "svādhyāya",
          "meaning": "studio di sé e dei testi sacri"
        },
        {
          "term": "īśvara",
          "meaning": "il Signore, la coscienza suprema"
        },
        {
          "term": "praṇidhānāni",
          "meaning": "dedizione, abbandono"
        },
        {
          "term": "kriyā",
          "meaning": "azione, pratica"
        },
        {
          "term": "yogaḥ",
          "meaning": "yoga"
        }
      ],
      "meaning": "La disciplina, lo studio di sé e l'abbandono al Signore costituiscono lo yoga dell'azione.",
      "explanation": "Il kriyā yoga riunisce disciplina, studio e dedizione in una pratica adatta a trasformare la vita quotidiana. Questi tre elementi agiscono su comportamento, comprensione e orientamento profondo, evitando che lo yoga rimanga soltanto teorico."
    },
    {
      "sutraId": "sutra_2_02",
      "pronunciation": "sa-mā-dhi bhā-va-nār-thaḥ kle-śa ta-nū-ka-ra-ṇār-thaś cha",
      "initialPronunciation": "sa-mā-dhi",
      "wordMeanings": [
        {
          "term": "samādhi",
          "meaning": "assorbimento meditativo"
        },
        {
          "term": "bhāvanārthaḥ",
          "meaning": "per coltivare, produrre"
        },
        {
          "term": "kleśa",
          "meaning": "afflizioni"
        },
        {
          "term": "tanūkaraṇārthaḥ",
          "meaning": "per attenuare, rendere sottili"
        },
        {
          "term": "ca",
          "meaning": "e"
        }
      ],
      "meaning": "Esso serve a coltivare il samādhi e ad attenuare le afflizioni.",
      "explanation": "Lo scopo del kriyā yoga è duplice: preparare il samādhi e indebolire le afflizioni. Non promette di eliminarle immediatamente, ma riduce il loro potere così che la mente possa diventare più stabile e trasparente."
    },
    {
      "sutraId": "sutra_2_03",
      "pronunciation": "a-vid-yā as-mi-tā rā-ga dve-ṣa a-bhi-ni-ve-śāḥ kle-śāḥ",
      "initialPronunciation": "a-vid-yā",
      "wordMeanings": [
        {
          "term": "avidyā",
          "meaning": "ignoranza"
        },
        {
          "term": "asmitā",
          "meaning": "senso dell'io"
        },
        {
          "term": "rāga",
          "meaning": "attaccamento"
        },
        {
          "term": "dveṣa",
          "meaning": "avversione"
        },
        {
          "term": "abhiniveśāḥ",
          "meaning": "attaccamento alla vita, paura della morte"
        },
        {
          "term": "kleśāḥ",
          "meaning": "afflizioni"
        }
      ],
      "meaning": "Le afflizioni sono ignoranza, senso dell'io, attaccamento, avversione e attaccamento alla vita.",
      "explanation": "Le cinque kleśa descrivono le radici fondamentali della sofferenza mentale. L'ignoranza sostiene le altre: da una visione confusa nascono identificazione, attrazione, repulsione e paura di perdere la continuità dell'esistenza."
    },
    {
      "sutraId": "sutra_2_04",
      "pronunciation": "a-vid-yā kṣe-tram ut-ta-re-ṣām pra-sup-ta ta-nu vich-chhin-na u-dā-rā-ṇām",
      "initialPronunciation": "a-vid-yā",
      "wordMeanings": [
        {
          "term": "avidyā",
          "meaning": "ignoranza"
        },
        {
          "term": "kṣetram",
          "meaning": "campo, terreno"
        },
        {
          "term": "uttareṣām",
          "meaning": "delle altre"
        },
        {
          "term": "prasupta",
          "meaning": "dormienti"
        },
        {
          "term": "tanu",
          "meaning": "attenuate"
        },
        {
          "term": "vicchinna",
          "meaning": "intermittenti"
        },
        {
          "term": "udārāṇām",
          "meaning": "pienamente attive"
        }
      ],
      "meaning": "L'ignoranza è il terreno delle altre afflizioni, dormienti, attenuate, intermittenti o pienamente attive.",
      "explanation": "Le afflizioni non sono sempre manifestamente attive. Possono restare latenti, essere attenuate dalla pratica, comparire in modo intermittente o dominare la mente; riconoscerne lo stato permette di comprenderne meglio l'azione."
    },
    {
      "sutraId": "sutra_2_05",
      "pronunciation": "a-ni-tya a-śu-chi duḥ-kha a-nāt-ma-su ni-tya śu-chi su-kha āt-ma khyā-tir a-vid-yā",
      "initialPronunciation": "a-ni-tya",
      "wordMeanings": [
        {
          "term": "anitya",
          "meaning": "impermanente"
        },
        {
          "term": "aśuci",
          "meaning": "impuro"
        },
        {
          "term": "duḥkha",
          "meaning": "dolore"
        },
        {
          "term": "anātmasu",
          "meaning": "nel non-Sé"
        },
        {
          "term": "nitya",
          "meaning": "permanente"
        },
        {
          "term": "śuci",
          "meaning": "puro"
        },
        {
          "term": "sukha",
          "meaning": "piacere"
        },
        {
          "term": "ātma",
          "meaning": "Sé"
        },
        {
          "term": "khyātiḥ",
          "meaning": "considerare, riconoscere"
        },
        {
          "term": "avidyā",
          "meaning": "ignoranza"
        }
      ],
      "meaning": "L'ignoranza scambia l'impermanente per permanente, l'impuro per puro, il dolore per piacere e il non-Sé per il Sé.",
      "explanation": "Avidyā non è semplice mancanza di informazioni, ma un modo capovolto di vedere. Attribuisce stabilità, purezza, felicità e identità a ciò che non le possiede in modo permanente, generando aspettative inevitabilmente fragili."
    },
    {
      "sutraId": "sutra_2_06",
      "pronunciation": "dṛg dar-śa-na śak-tyor e-kāt-ma-tā i-va as-mi-tā",
      "initialPronunciation": "dṛg",
      "wordMeanings": [
        {
          "term": "dṛg",
          "meaning": "il veggente"
        },
        {
          "term": "darśana",
          "meaning": "la visione"
        },
        {
          "term": "śaktyoḥ",
          "meaning": "dei due poteri"
        },
        {
          "term": "ekātmatā",
          "meaning": "identità, unità"
        },
        {
          "term": "iva",
          "meaning": "come se, apparente"
        },
        {
          "term": "asmitā",
          "meaning": "senso dell'io"
        }
      ],
      "meaning": "Il senso dell'io è l'apparente identità tra il veggente e il potere della visione.",
      "explanation": "Asmitā sorge quando la pura facoltà di vedere viene confusa con lo strumento mentale attraverso cui avviene la conoscenza. Il pensiero 'io sono questo' attribuisce al veggente proprietà che appartengono invece alla mente e alla natura."
    },
    {
      "sutraId": "sutra_2_07",
      "pronunciation": "su-kha a-nu-śa-yī rā-gaḥ",
      "initialPronunciation": "su-kha",
      "wordMeanings": [
        {
          "term": "sukha",
          "meaning": "piacere"
        },
        {
          "term": "anuśayī",
          "meaning": "che segue, che si appoggia a"
        },
        {
          "term": "rāgaḥ",
          "meaning": "attaccamento"
        }
      ],
      "meaning": "L'attaccamento segue l'esperienza del piacere.",
      "explanation": "Rāga è la tendenza a trattenere o ripetere ciò che ha prodotto piacere. Non coincide con il piacere stesso: è l'impronta che lo trasforma in desiderio e rende la serenità dipendente dal suo ritorno."
    },
    {
      "sutraId": "sutra_2_08",
      "pronunciation": "duḥ-kha a-nu-śa-yī dve-ṣaḥ",
      "initialPronunciation": "duḥ-kha",
      "wordMeanings": [
        {
          "term": "duḥkha",
          "meaning": "dolore"
        },
        {
          "term": "anuśayī",
          "meaning": "che segue, che si appoggia a"
        },
        {
          "term": "dveṣaḥ",
          "meaning": "avversione"
        }
      ],
      "meaning": "L'avversione segue l'esperienza del dolore.",
      "explanation": "Dveṣa è la tendenza a respingere ciò che è stato associato al dolore. Anche quando protegge da un pericolo reale, può fissarsi come reazione automatica e impedire di vedere la situazione presente per ciò che è."
    },
    {
      "sutraId": "sutra_2_09",
      "pronunciation": "sva ra-sa vā-hī vi-du-ṣo a-pi ta-thā rū-ḍhaḥ a-bhi-ni-ve-śaḥ",
      "initialPronunciation": "sva",
      "wordMeanings": [
        {
          "term": "sva",
          "meaning": "proprio"
        },
        {
          "term": "rasa",
          "meaning": "impulso, inclinazione"
        },
        {
          "term": "vāhī",
          "meaning": "che scorre, che procede"
        },
        {
          "term": "viduṣaḥ",
          "meaning": "nel sapiente"
        },
        {
          "term": "api",
          "meaning": "anche"
        },
        {
          "term": "tathā",
          "meaning": "così"
        },
        {
          "term": "rūḍhaḥ",
          "meaning": "profondamente radicato"
        },
        {
          "term": "abhiniveśaḥ",
          "meaning": "attaccamento alla vita, paura della morte"
        }
      ],
      "meaning": "L'attaccamento alla vita procede per impulso proprio ed è radicato anche nel sapiente.",
      "explanation": "Abhiniveśa è il profondo impulso a conservare la propria continuità e a evitare la dissoluzione. La sua presenza anche nel sapiente mostra che non è soltanto un pensiero cosciente, ma una tendenza radicata negli strati più profondi della vita."